{
  "schema_version": 1,
  "review_id": "ACTREVIEW-ACCENT-BASE-1",
  "verification_evidence_id": "MODELEVID-ACCENT-BASE-1",
  "model_id": "vsn-accent-base",
  "model_version": "1.0.0",
  "artifact_id": "MODELART-ACCENT-BASE-1",
  "artifact_sha256": "aaaaaaaaaaaaaaaaaaaaaaaaaaaaaaaaaaaaaaaaaaaaaaaaaaaaaaaaaaaaaaaa",
  "provider_id": "vsn-accent-runtime",
  "access_mode": "internal",
  "capabilities": [
    "voice.accent_convert",
    "voice.identity_preserve"
  ],
  "candidate_state": {
    "enabled": false,
    "verified_access": false,
    "health": "unhealthy",
    "rate_limit": "unknown"
  },
  "evidence_refs": {
    "runtime_access": "EVIDENCE-RUNTIME-ACCESS-ACCENT-BASE-1",
    "artifact_signature": "EVIDENCE-ARTIFACT-SIGNATURE-ACCENT-BASE-1",
    "release_provenance": "EVIDENCE-RELEASE-PROVENANCE-ACCENT-BASE-1",
    "benchmark_policy": "EVIDENCE-BENCHMARK-POLICY-ACCENT-BASE-1",
    "rollback_readiness": "EVIDENCE-ROLLBACK-READINESS-ACCENT-BASE-1"
  },
  "activation_authorized": false
}
